<?xml version="1.0" encoding="UTF-8"?>
<candidature
xmlns:xsi="http://www.w3.org/2001/XMLSchema-instance"
xsi:noNamespaceSchemaLocation="candidature.xsd">
  <idCandidature>1</idCandidature>
  <dateCandidature>12/04/2018</dateCandidature>
  <identiteCandidat>
    <nom>Durand</nom>
    <prenom>Jacques-yves</prenom>
    <tel>0612345678</tel>
    <mail>d.jacky@iopmail.com</mail>
  </identiteCandidat>
  <structure>
    <raisonSocial>Jacky la bidouille</raisonSocial>
    <siret>73282932000074</siret>
    <ca>20</ca>
  </structure>
  <repProjet>
    <delais>15</delais>
    <devis>http://monServeur/devis/1</devis>
    <liens>http://www.JackyBidouille.com</liens>
    <fichiers>
      <fichier>http://monServeur/fichiers/1-1</fichier>
      <fichier>http://monServeur/fichiers/1-2</fichier>
    </fichiers>
    <idProjet>1</idProjet>
  </repProjet>
</candidature>
